{
  "architecture": {
    "exposed_ports": [
      "com.verto.app.feature.profile.domain.repository.ProfileGateway"
    ],
    "external_dependencies": [
      "implementation:libs.androidx.activity.compose",
      "implementation:libs.androidx.compose.foundation",
      "implementation:libs.androidx.core.ktx",
      "implementation:libs.androidx.lifecycle.runtime.compose",
      "implementation:libs.androidx.lifecycle.runtime.ktx",
      "implementation:libs.androidx.lifecycle.viewmodel.compose",
      "implementation:libs.androidx.material.icons.extended",
      "implementation:libs.androidx.material3",
      "implementation:libs.hilt.navigation.compose",
      "implementation:libs.kotlinx.coroutines.core"
    ],
    "forbidden_dependencies": [
      "ALL_UNDECLARED_PROJECT_DEPENDENCIES",
      "OTHER_FEATURE_INTERNAL_IMPLEMENTATION",
      "FOREIGN_ENTITY_DAO_OR_STORAGE_IMPLEMENTATION"
    ],
    "incoming_dependencies": [
      ":app"
    ],
    "internal_packages": [
      "com.verto.app.feature.profile.domain.model",
      "com.verto.app.feature.profile.domain.repository",
      "com.verto.app.feature.profile.presentation"
    ],
    "outgoing_dependencies": [
      ":core:common",
      ":core:crash",
      ":core:designsystem"
    ],
    "public_api": [
      "com.verto.app.feature.profile.bridge.ProfileGatewayAdapter",
      "com.verto.app.feature.profile.domain.model.UserProfile",
      "com.verto.app.feature.profile.domain.repository.ProfileGateway",
      "com.verto.app.feature.profile.presentation.ProfileEditDialog",
      "com.verto.app.feature.profile.presentation.ProfileOperationState",
      "com.verto.app.feature.profile.presentation.ProfileSettingsViewModel"
    ]
  },
  "data": {
    "owned_entities": [],
    "owned_repositories": [
      "ProfileGateway"
    ],
    "owned_tables": []
  },
  "feature": {
    "module": ":feature:profile",
    "name": "feature/profile",
    "owner": ":feature:profile",
    "purpose": "Production capability implemented by :feature:profile; behavior remains defined by current v318 source and canonical feature documentation."
  },
  "integration": {
    "allowed_cross_feature_ports": [],
    "allowed_public_api_dependencies": [],
    "legacy_cross_feature_debt": []
  },
  "provides_contracts": ["profile.gateway.v1"],
  "consumes_contracts": [],
  "deprecated_contracts": [],
  "verification": {
    "public_api_surface_algorithm": "verto-top-level-public-surface-v1",
    "public_api_surface_hash": "f0800db724579ff7878ab07460b6a22b0ab28c28bab6a0c80e97a39c59cf4657",
    "source_sha256": "187ea40c612068563b8b57833bdfe6c38b7beea8b3b12352326b34e0727cc311",
    "verified_against": "v318"
  }
}
