{
  "architecture": {
    "exposed_ports": [
      "com.verto.app.feature.messages.application.MessagesGateway",
      "com.verto.app.feature.messages.bridge.SupabaseMessagesGateway",
      "com.verto.app.feature.messages.domain.port.CompanyMessageTimelinePort",
      "com.verto.app.feature.messages.domain.port.MessageOwnerPort"
    ],
    "external_dependencies": [
      "implementation:libs.androidx.activity.compose",
      "implementation:libs.androidx.compose.foundation",
      "implementation:libs.androidx.core.ktx",
      "implementation:libs.androidx.lifecycle.runtime.compose",
      "implementation:libs.androidx.lifecycle.runtime.ktx",
      "implementation:libs.androidx.lifecycle.viewmodel.compose",
      "implementation:libs.androidx.material.icons.extended",
      "implementation:libs.androidx.material3",
      "implementation:libs.coil.compose",
      "implementation:libs.hilt.navigation.compose",
      "implementation:libs.kotlinx.coroutines.core"
    ],
    "forbidden_dependencies": [
      "ALL_UNDECLARED_PROJECT_DEPENDENCIES",
      "OTHER_FEATURE_INTERNAL_IMPLEMENTATION",
      "FOREIGN_ENTITY_DAO_OR_STORAGE_IMPLEMENTATION"
    ],
    "incoming_dependencies": [
      ":app"
    ],
    "internal_packages": [
      "com.verto.app.feature.messages.application",
      "com.verto.app.feature.messages.data",
      "com.verto.app.feature.messages.di",
      "com.verto.app.feature.messages.domain.port",
      "com.verto.app.ui.screens.messages"
    ],
    "outgoing_dependencies": [
      ":core:common",
      ":core:crash",
      ":core:designsystem",
      ":data:database"
    ],
    "public_api": [
      "com.verto.app.feature.messages.application.ConversationListItem",
      "com.verto.app.feature.messages.application.MessageItem",
      "com.verto.app.feature.messages.application.MessageKind",
      "com.verto.app.feature.messages.application.MessagesGateway",
      "com.verto.app.feature.messages.application.MessagingServerContractException",
      "com.verto.app.feature.messages.application.RegisteredMarketerItem",
      "com.verto.app.feature.messages.application.SendMessageCommand",
      "com.verto.app.feature.messages.bridge.GatewayCompanyMessageTimelineAdapter",
      "com.verto.app.feature.messages.bridge.SupabaseMessagesGateway",
      "com.verto.app.feature.messages.data.MessagesRealtimeSource",
      "com.verto.app.feature.messages.data.SupabaseMessagesRealtimeSource",
      "com.verto.app.feature.messages.domain.port.CompanyMessageTimelineItem",
      "com.verto.app.feature.messages.domain.port.CompanyMessageTimelineKind",
      "com.verto.app.feature.messages.domain.port.CompanyMessageTimelinePort",
      "com.verto.app.feature.messages.domain.port.EnsureOwnedConversationCommand",
      "com.verto.app.feature.messages.domain.port.MessageOwnerPort",
      "com.verto.app.feature.messages.domain.port.OwnedConversation",
      "com.verto.app.feature.messages.domain.port.OwnedMessage",
      "com.verto.app.feature.messages.domain.port.OwnedMessageDeliveryStatus",
      "com.verto.app.feature.messages.domain.port.OwnedMessageKind",
      "com.verto.app.feature.messages.domain.port.OwnedMessageMedia",
      "com.verto.app.feature.messages.domain.port.OwnedMessageMediaDraft",
      "com.verto.app.feature.messages.domain.port.OwnedSenderSnapshot",
      "com.verto.app.feature.messages.domain.port.PersistOwnedMessageCommand"
    ]
  },
  "data": {
    "owned_entities": [],
    "owned_repositories": [],
    "owned_tables": []
  },
  "feature": {
    "module": ":feature:messages",
    "name": "feature/messages",
    "owner": ":feature:messages",
    "purpose": "Production capability implemented by :feature:messages; behavior remains defined by current v318 source and canonical feature documentation."
  },
  "integration": {
    "allowed_cross_feature_ports": [],
    "allowed_public_api_dependencies": [],
    "legacy_cross_feature_debt": []
  },
  "provides_contracts": ["messages.gateway.v1"],
  "consumes_contracts": [],
  "deprecated_contracts": [],
  "verification": {
    "public_api_surface_algorithm": "verto-top-level-public-surface-v1",
    "public_api_surface_hash": "07dd0072b8788909dd2a5f312c22ed6c586f5ea403de643571dd1f87526c6ab5",
    "source_sha256": "187ea40c612068563b8b57833bdfe6c38b7beea8b3b12352326b34e0727cc311",
    "verified_against": "v318"
  }
}
